{
  "$schema": "https://json-schema.org/draft/2020-12/schema",
  "$id": "https://nokta.local/schemas/agent-pack.schema.json",
  "title": "AgentPack",
  "type": "object",
  "required": ["id", "version", "title", "role", "scope", "inputs", "outputs", "handoff"],
  "properties": {
    "id": { "type": "string", "pattern": "^[a-z0-9][a-z0-9.-]*$" },
    "version": { "type": "string" },
    "title": { "type": "string" },
    "role": { "type": "string" },
    "scope": { "type": "array", "items": { "type": "string" } },
    "inputs": { "type": "array", "items": { "type": "string" } },
    "outputs": { "type": "array", "items": { "type": "string" } },
    "handoff": { "type": "array", "items": { "type": "string" } },
    "defaultPacks": { "type": "array", "items": { "type": "string" } },
    "cannotDo": { "type": "array", "items": { "type": "string" } },
    "division": { "type": "string" },
    "divisionLabel": { "type": "string" },
    "divisionIcon": { "type": "string" },
    "divisionColor": { "type": "string" },
    "emoji": { "type": "string" },
    "vibe": { "type": "string" },
    "criticalRules": { "type": "array", "items": { "type": "string" } },
    "instructions": { "type": "string" },
    "source": { "type": "string" }
  },
  "additionalProperties": false
}
